{
  "id": "real-estate-core",
  "version": "1.0.0",
  "type": "industry",
  "locales": ["it-IT", "es-MX", "es", "en"],
  "requires": [],
  "prerequisites": {
    "integrations": ["whatsapp_optional", "instagram_optional"],
    "data": ["business_name", "city"]
  },
  "provisions": {
    "tabs": ["Listings", "Runs", "Insights", "Compliance"],
    "quick_actions": ["post_listing", "follow_up_leads"],
    "default_agents": ["listing_agent"],
    "default_workflows": ["lead_followup"]
  }
}
